{
  "$schema": "../../schemas/plugin.schema.json",
  "name": "headroom",
  "version": "0.1.0",
  "joint": "compress",
  "status": "implemented",
  "transport": "python",
  "entry": "adapter.py",
  "summary": "Project's Headroom tenant: compress large outputs to a summary + handle, expand within one hour",
  "requires": {
    "services": [
      "headroom"
    ],
    "tenant": "headroom"
  },
  "expose": [
    "orchestrator",
    "worker-mcp"
  ],
  "mcp": {
    "name": "mstack_headroom",
    "command": [
      "{python}",
      "{stack}/integrations/tenants/launch.py",
      "--project",
      "{project}",
      "--tool",
      "headroom"
    ],
    "hint": "pass large JSON or structured tool output to headroom_compress and work from the summary (plain text/logs are not reduced); headroom_retrieve(hash) returns the original for one hour."
  }
}
